Marca;Nombre;;Precio Und;Precio XM,Genero,Precio_Optimizado
"Rasasi;RASASI SORYANI MUJER 100 ML EDP ;; $20.807 ; $19.807 ","Mujer","1002080719990"
"RAYHAAN;RAYHAAN ELIXIR EDP (DUPE LE MALE ELIXIR) 100ML ;NUEVO; $25.849 ; $24.849 ","Unisex","1002584924990"
"Sin categorizar;FRAGRANCE WORLD CHAMPION MONEY EDP 80 ML  HOMBRE ;NUEVO; $20.807 ; $19.807 ","Hombre","802080719990"
"THIERRY MUGLER;SET THIERRY MUGLER ANGEL PARFUM 50ML + 10ML MUJER ;NUEVO; $63.992 ; $62.992 ","Mujer","50106399263990"
"Thierry Mugler;THIERRY MUGLER A MAN MUGLER MAN 100ML EDT ;; $43.403 ; $42.403 ","Unisex","1004340342990"
"THIERRY MUGLER;THIERRY MUGLER A MEN FANTASM 100 ML EDP ;; $58.622 ; $57.622 ","Hombre","1005862257990"
"Thierry Mugler;THIERRY MUGLER ALIEN GODDESS PARFUM MUJER 30 ML EDP ;; $33.403 ; $32.403 ","Mujer","303340332990"
"THIERRY MUGLER;THIERRY MUGLER ALIEN HYPERSENSE PARFUM MUJER 90ML EDP ;; $71.218 ; $70.218 ","Mujer","907121870990"
"THIERRY MUGLER;THIERRY MUGLER ALIEN MUGLER TALISMAN PARFUM 60 ML EDP ;NUEVO; $46.017 ; $45.017 ","Unisex","604601745990"
"THIERRY MUGLER;THIERRY MUGLER ALIEN MUJER 90ML EDP ;; $83.992 ; $82.992 ","Mujer","908399283990"
"THIERRY MUGLER;THIERRY MUGLER ANGEL ELIXIR MUJER RECARGABLE 100ML EDP ;; $83.992 ; $82.992 ","Mujer","1008399283990"
"THIERRY MUGLER;THIERRY MUGLER ANGEL FANTASM PARFUM 100ML MUJER ;; $96.437 ; $95.437 ","Mujer","1009643795990"
"Thierry Mugler;THIERRY MUGLER ANGEL MUGLER 25 ML EDP ;; $83.992 ; $82.992 ","Unisex","258399283990"
"THIERRY MUGLER;THIERRY MUGLER ANGEL NOVA PARFUM MUJER 50ML EDP ;; $57.496 ; $56.496 ","Mujer","505749656990"
"THIERRY MUGLER;THIERRY MUGLER ELIXIR PARFUM MUJER 50ML EDP ;; $73.992 ; $72.992 ","Mujer","507399273990"
"Tom Ford;TOM FORD TUSCAN LEATHER PARFUM 50ML EDP ;NUEVO; $180.471 ; $179.471 ","Unisex","50180471179990"
"Tommy Hilfiger;TOMMY GIRL FOREVER EDT 100 ML ;NUEVO; $29.210 ; $28.210 ","Unisex","1002921028990"
"TOMMY HILFIGER;TOMMY HILFIGER GIRL 200ML EDT ;; $31.723 ; $30.723 ","Unisex","2003172330990"
"Tommy Hilfiger;TOMMY HILFIGER GIRL SIN CELOFAN 100ML EDT ;; $25.840 ; $24.840 ","Unisex","1002584024990"
"Tommy Hilfiger;TOMMY HILFIGER MAN 200ML EDT ;; $32.143 ; $31.143 ","Unisex","2003214331990"
"Tommy Hilfiger;TOMMY HILFIGER MAN SIN CELOFAN 100 ML EDT ;NUEVO; $25.000 ; $24.000 ","Unisex","1002500024990"
"Versace;TESTER VERSACE EROS MAN 100ML EDT (CON TAPA) ;; $35.084 ; $34.084 ","Unisex","1003508434990"
"VERSACE;VERSACE BRIGHT CRYSTAL WOMAN 90ML EDT ;; $46.857 ; $45.857 ","Unisex","904685745990"
"VERSACE;VERSACE EROS ENERGY POUR HOMME EDP 100 ML ;; $56.849 ; $55.849 ","Hombre","1005684955990"
"Versace;VERSACE EROS MAN 100ML EDP ;; $57.773 ; $56.773 ","Unisex","1005777356990"
"VERSACE;VERSACE EROS PARFUM HOMBRE 100 ML EDP ;; $59.462 ; $58.462 ","Hombre","1005946258990"
"VERSACE;VERSACE POUR HOMME  200ML EDT ;; $60.294 ; $59.294 ","Hombre","2006029459990"
"VICTORIA SECRET;VICTORIA SECRET CREMA LOVE SPELL 236ML ;; $15.765 ; $14.765 ","Unisex","2361576514990"
"Victoria Secret;VICTORIA SECRET LOVE ADDICT MUJER 250 ML LOCION ;; $14.496 ; $13.496 ","Mujer","2501449613990"
"VICTORINOX;VICTORINOX ALTITUDE MAN 100ML EDP ;; $22.479 ; $21.479 ","Unisex","1002247921990"
"VIKTOR AND ROLF;SET VIKTOR AND ROLF FLOWERBOMB 100 ML + 10 ML ;; $63.992 ; $62.992 ","Unisex","100106399263990"
"VIKTOR AND ROLF;SET VIKTOR AND ROLF FLOWERBOMB 100 ML + 10 ML + 200 ML SG ;; $63.992 ; $62.992 ","Unisex","100102006399264000"
"VIKTOR AND ROLF;SET VIKTOR AND ROLF FLOWERBOMB 50ML + 10ML EDP ;; $67.017 ; $66.017 ","Unisex","50106701766990"
"VIKTOR AND ROLF;SET VIKTOR AND ROLF SPICEBOMB EDT 90ML + 20ML ;; $54.412 ; $53.412 ","Unisex","90205441253990"
"VIKTOR AND ROLF;VIKTOR AND ROLD FLOWERBOMB RUBY ORCHID MUJER 30ML EDP ;; $32.571 ; $31.571 ","Mujer","303257131990"
"VIKTOR AND ROLF;VIKTOR AND ROLD GOOD FORTUNE MUJER 90ML EDP ;; $50.218 ; $49.218 ","Mujer","905021849990"
"VIKTOR AND ROLF;VIKTOR AND ROLD SPICEBOMB INFRARED HOMBRE 50ML EDT ;; $38.454 ; $37.454 ","Hombre","503845437990"
"VIKTOR AND ROLF;VIKTOR AND ROLF DARK LEATHER HOMBRE PARFUM 90ML ;; $69.546 ; $68.546 ","Hombre","906954668990"
"VIKTOR AND ROLF;VIKTOR AND ROLF FLOWERBOMB EXTREME 50 ML MUJER ;NUEVO; $63.992 ; $62.992 ","Mujer","506399263990"
"VIKTOR AND ROLF;VIKTOR AND ROLF FLOWERBOMB MUJER 30ML EDP ;; $34.252 ; $33.252 ","Mujer","303425233990"
"VIKTOR AND ROLF;VIKTOR AND ROLF GOOD FORTUNE MUJER 30ML EDP ;; $34.252 ; $33.252 ","Mujer","303425233990"
"VIKTOR AND ROLF;VIKTOR AND ROLF SPICEBOMB MAN 50ML EDT ;; $43.992 ; $42.992 ","Unisex","504399243990"
"VIKTOR AND ROLF;VIKTOR ANDA ROLF SPICEBOMB DARK LEATHER PARFUM 50ML HOMBRE ;; $41.815 ; $40.815 ","Hombre","504181540990"
"VIKTOR AND ROLF;VIKTOR ROLF SPICEBOMB POUR HOMME 90ML EDT ;NUEVO; $58.622 ; $57.622 ","Hombre","905862257990"
"VIKTOR AND ROLF;VR FLOWERBOMB EXTREME EDP INTENSE 100ML ;; $58.622 ; $57.622 ","Unisex","1005862257990"
"VOLARE;Volar� Gladiator Twilight Le Beau EDP 100 ml ;; $19.546 ; $18.546 ","Unisex","1001954618990"
"VOLARE;Volar� Gladiator Twilight Le Male EDP 100 ml ;; $19.546 ; $18.546 ","Unisex","1001954618990"
"Volar�;Volar� Gladiator Twilight Parfum EDP 100 ml ;; $19.126 ; $18.126 ","Unisex","1001912618990"
"Yves Saint Laurent;YVES SAINT LAUREN MYSLF 60 ML EDP ;; $67.857 ; $66.857 ","Unisex","606785766990"
"Yves Saint Laurent;YVES SAINT LAURENT ''Y'' EAU DE TOILETTE 100 ML ;; $70.378 ; $69.378 ","Unisex","1007037869990"
"YVES SAINT LAURENT;YVES SAINT LAURENT BLACK OPIUM ''LE PARFUM'' 90ML ;; $85.504 ; $84.504 ","Unisex","908550484990"
"YVES SAINT LAURENT;YVES SAINT LAURENT Y ''LE PARFUM'' HOMBRE 100ML ;; $87.613 ; $86.613 ","Hombre","1008761386990"
"Yves Saint Laurent;YVES SAINT LAURENT Y 100 ML EDP INTENSE ;; $76.261 ; $75.261 ","Unisex","1007626175990"
"YVES SAINT LAURENT;YVEST SAINT LAURENT LIBRE PARFUM INTENSE 90ML ;; $85.504 ; $84.504 ","Unisex","908550484990"
