Marca;Nombre;;Precio Und;Precio XM,Genero,Precio_Optimizado
"Hugo Boss;HUGO BOSS BOTTLED NIGHT 100ML EDT ;; $37.605 ; $36.605 ","Unisex","1003760536990"
"HUGO BOSS;HUGO BOSS BOTTLED PARFUM HOMBRE 50ML EDP ;NUEVO; $26.849 ; $25.849 ","Hombre","502684925990"
"HUGO BOSS;HUGO BOSS BOTTLED UNLIMITED EDT 100ML EDT ;NUEVO; $41.815 ; $40.815 ","Unisex","1004181540990"
"HUGO BOSS;HUGO BOSS CANTIMPLORA VERDE 200ML EDT ;; $60.042 ; $59.042 ","Unisex","2006004259990"
"HUGO BOSS;HUGO BOSS DEEP RED WOMAN 50ML EDP ;NUEVO; $19.042 ; $18.042 ","Unisex","501904218990"
"HUGO BOSS;HUGO BOSS JEANS HOMBRE125ML EDT ;NUEVO; $41.815 ; $40.815 ","Hombre","1254181540990"
"HUGO BOSS;HUGO BOSS JUST DIFFERENT MAN 75ML EDT ;NUEVO; $24.916 ; $23.916 ","Unisex","752491623990"
"Hugo Boss;HUGO BOSS MAN CANTIMPLORA VERDE 125ML EDT ;; $32.395 ; $31.395 ","Unisex","1253239531990"
"Hugo Boss;HUGO BOSS MAN ORANGE 100ML EDT ;; $24.160 ; $23.160 ","Unisex","1002416023990"
"HUGO BOSS;HUGO BOSS SUPERMAN X HUGO PARFUM  125ML ;; $50.714 ; $49.714 ","Unisex","1255071449990"
"Hugo Boss;HUGO BOSS THE SCENT FOR HER 100ML EDP ;; $51.059 ; $50.059 ","Unisex","1005105950990"
"HUGO BOSS;HUGO BOSS THE SCENT HOMBRE 50 ML EDT ;; $25.008 ; $24.008 ","Hombre","502500824990"
"HUGO BOSS;HUGO BOSS XY MAN 100ML EDT ;; $33.235 ; $32.235 ","Unisex","1003323532990"
"HUGO BOSS;HUGO JEANS EDT 75 ML ;; $41.815 ; $40.815 ","Unisex","754181540990"
"Issey Miyake;ISSEY MIYAKE L' EAU D' ISSEY POUR HOMME 125ML EDT ;NUEVO; $40.966 ; $39.966 ","Hombre","1254096639990"
"Issey Miyake;ISSEY MIYAKE L'EAU D'ISSEY MUJER 100ML EDT ;NUEVO; $37.605 ; $36.605 ","Mujer","1003760536990"
"JEAN PAUL GAULTIER;JEAN PAUL GAULTIER ''LE MALE'' LE PARFUM EDP INTENSE 125ML ;; $82.311 ; $81.311 ","Unisex","1258231181990"
"Jean Paul Gaultier;JEAN PAUL GAULTIER CLASSIQUE FEMME 80ML EDP ;NUEVO; $52.739 ; $51.739 ","Unisex","805273951990"
"JEAN PAUL GAULTIER;JEAN PAUL GAULTIER LE BEAU HOMBRE 125 ML EDT ;; $82.899 ; $81.899 ","Hombre","1258289981990"
"Jean Paul Gaultier;JEAN PAUL GAULTIER LE BEAU LE PARFUM 75ML EDP ;; $65.168 ; $64.168 ","Unisex","756516864990"
"Jean Paul Gaultier;JEAN PAUL GAULTIER LE BEAU LE PARFUM EDP INTENSE 125 ML ;; $92.899 ; $91.899 ","Unisex","1259289991990"
"JEAN PAUL GAULTIER;JEAN PAUL GAULTIER LE BEAU PARADISE GARDEN EDP 125 ML HOMBRE ;; $86.261 ; $85.261 ","Hombre","1258626185990"
"JEAN PAUL GAULTIER;JEAN PAUL GAULTIER LE BEAU PARADISE GARDEN EDP 75 ML ;; $65.168 ; $64.168 ","Unisex","756516864990"
"JEAN PAUL GAULTIER;JEAN PAUL GAULTIER LE MALE ELIXIR PARFUM 75 ML ;; $75.000 ; $74.000 ","Unisex","757500074990"
"JEAN PAUL GAULTIER;JEAN PAUL GAULTIER LE MALE LE PARFUM 75ML EDP ;; $69.546 ; $68.546 ","Unisex","756954668990"
"JEAN PAUL GAULTIER;JEAN PAUL GAULTIER LE MALE MAN 125ML EDT ;NUEVO; $67.025 ; $66.025 ","Unisex","1256702566990"
"JEAN PAUL GAULTIER;JEAN PAUL GAULTIER LE MALE ULTRA MALE INTENSE 125ML EDT ;; $83.193 ; $82.193 ","Unisex","1258319382990"
"JEAN PAUL GAULTIER;JEAN PAUL GAULTIER SCANDAL HOMBRE 100ML EDT ;; $81.303 ; $80.303 ","Hombre","1008130380990"
"Jean Paul Gaultier;JEAN PAUL GAULTIER SCANDAL MUJER 100ML EDP ;; $87.017 ; $86.017 ","Mujer","1008701786990"
"Jean Paul Gaultier;JEAN PAUL GAULTIER SCANDAL PARFUM HOMBRE 100 ML EDP ;; $92.899 ; $91.899 ","Hombre","1009289991990"
"JEAN PAUL GAULTIER;SET JEAN PAUL GAULTIER SCANDAL ABSOLU PARFUM 80M CONCENTR� 80ML +10ML MUJER ;NUEVO; $84.672 ; $83.672 ","Mujer","8080108467283990"
"JO MILANO;JO MILANO GAME OF SPADES FULL-HOUSE PARFUM 100 ML ;; $57.269 ; $56.269 ","Unisex","1005726956990"
"JO MILANO;JO MILANO GAME OF SPADES OPAL PARFUM 90 ML ;; $57.782 ; $56.782 ","Unisex","905778256990"
"JO MILANO;JO MILANO GAME OF SPADES ROUGE PARFUM 100 ML UNISEX ;; $46.857 ; $45.857 ","Unisex","1004685745990"
"JO MILANO;JO MILANO GAME OF SPADES WILDCARD PARFUM 100 ML UNISEX ;NUEVO; $53.571 ; $52.571 ","Unisex","1005357152990"
"KHADLAJ;KHADLAJ EMPIRE CROWN EDP 100 ML ;; $14.924 ; $13.924 ","Unisex","1001492413990"
"Lancome;LANCOME LA NUIT TRESOR 75ML EDP ;; $67.017 ; $66.017 ","Unisex","756701766990"
"LANCOME;LANCOME TRESOR 100ML EDP ;; $84.580 ; $83.580 ","Unisex","1008458083990"
"Lancome;TESTER LANCOME LA VIE EST BELLE IRIS ABSOLU MUJER 50ML EDP ;NUEVO; $39.000 ; $38.000 ","Mujer","503900038990"
"LATTAFA;ARIANA GRANDE MOD BLUSH MUJER EDP 100 ML ;NUEVO; $43.600 ; $42.600 ","Mujer","1004360042990"
"LATTAFA;DESODORANTE BADEE AL OUD FOR GLORY MEN 200 ML SPRAY ;; $6.092 ; $5.092 ","Hombre","20060925990"
"Lattafa;DESODORANTE LATTAFA AMEERAT AL ARAB SPRAY 200 ML ;; $6.008 ; $5.008 ","Unisex","20060085990"
"LATTAFA;DESODORANTE LATTAFA ASAD MEN 200 ML SPRAY ;; $6.092 ; $5.092 ","Hombre","20060925990"
"Lattafa;DESODORANTE LATTAFA BADEE AL OUD AMETHYTS 200ML ;; $6.092 ; $5.092 ","Unisex","20060925990"
"Lattafa;DESODORANTE LATTAFA FAKHAR GOLD 200ML MUJER ;; $6.092 ; $5.092 ","Mujer","20060925990"
"LATTAFA;DESODORANTE LATTAFA FAKHAR MEN 200 ML SPRAY ;; $5.924 ; $4.924 ","Hombre","20059244990"
"LATTAFA;DESODORANTE LATTAFA HAYAATI MEN 200 ML SPRAY ;; $5.924 ; $4.924 ","Hombre","20059244990"
"LATTAFA;DESODORANTE LATTAFA KHAMRAH UNISEX 200 ML SPRAY ;; $6.092 ; $5.092 ","Unisex","20060925990"
"LATTAFA;DESODORANTE LATTAFA MAYAR MUJER 200 ML SPRAY ;; $6.092 ; $5.092 ","Mujer","20060925990"
"Lattafa;DESODORANTE LATTAFA QAED AL FURSAN 200 ML HOMBRE ;; $5.924 ; $4.924 ","Hombre","20059244990"
"LATTAFA;DESODORANTE LATTAFA YARA MOI SPRAY 200 ML ;; $6.008 ; $5.008 ","Unisex","20060085990"
"LATTAFA;DESODORANTE LATTAFA YARA ROSADO WOMAN 200 ML ;; $6.008 ; $5.008 ","Unisex","20060085990"
"LATTAFA;LATAFFA CARAT PURE GOLD UNISEX 100 ML EDP ;; $12.403 ; $11.403 ","Unisex","1001240311990"
"LATTAFA;LATAFFA MUSAMAN WHITE UNISEX 100 ML EDP ;NUEVO; $29.202 ; $28.202 ","Unisex","1002920228990"
"Lattafa;LATAFFA QAA ED SHABAAB HOMBRE 100 ML EDP ;NUEVO; $18.286 ; $17.286 ","Hombre","1001828617990"
"LATTAFA;LATAFFA YARA MUJER 50 ML EDP ;; $6.849 ; $5.849 ","Mujer","5068495990"
"Lattafa;LATTAFA ADEEB UNISEX 80 ML EDP ;; $20.798 ; $19.798 ","Unisex","802079819990"
"LATTAFA;LATTAFA AFFECTION EDP 100 ML ;; $20.798 ; $19.798 ","Unisex","1002079819990"
"LATTAFA;LATTAFA AJWAD PINK TO PINK MUJER 60ML EDP ;; $16.521 ; $15.521 ","Mujer","601652115990"
"LATTAFA;LATTAFA AJWAD UNISEX 100 ML EDP ;NUEVO; $15.756 ; $14.756 ","Unisex","1001575614990"
"LATTAFA;LATTAFA AL ANA ABIYEDH 60ML UNISEX EDP ;NUEVO; $14.496 ; $13.496 ","Unisex","601449613990"
"Lattafa;LATTAFA AL QIAM SILVER UNISEX 100ML EDP ;; $22.899 ; $21.899 ","Unisex","1002289921990"
"LATTAFA;LATTAFA ALHAMBRA PHILOS ROSSO UNISEX 100ML EDP ;NUEVO; $14.076 ; $13.076 ","Unisex","1001407613990"
"Lattafa;LATTAFA AMEER AL OUDH UNISEX 100 ML EDP ;; $16.605 ; $15.605 ","Unisex","1001660515990"
"LATTAFA;LATTAFA AMETHYST UNISEX 100ML EDP ;; $21.639 ; $20.639 ","Unisex","1002163920990"
"LATTAFA;LATTAFA ANARCH UNISEX 100ML EDP (TIZIANA TERENZI ANDROMEDA) ;; $14.504 ; $13.504 ","Unisex","1001450413990"
"LATTAFA;LATTAFA ASAD BOURBON 100ML EDP ;NUEVO; $23.319 ; $22.319 ","Unisex","1002331922990"
"LATTAFA;LATTAFA ASAD EDP 12 ML HOMBRE ;; $7.353 ; $6.353 ","Hombre","1273536990"
"LATTAFA;LATTAFA ASAD MAN 100ML EDP ;NUEVO; $19.538 ; $18.538 ","Unisex","1001953818990"
"Lattafa;LATTAFA AWRAQ AL OUD HOMBRE 100 ML EDP ;; $14.924 ; $13.924 ","Hombre","1001492413990"
"LATTAFA;LATTAFA BADEE AL OUD BLUSH MUJER 100ML EDP ;NUEVO; $21.639 ; $20.639 ","Mujer","1002163920990"
"Lattafa;LATTAFA BADEE AL OUD SUBLIME  UNISEX 100 ML EDP ;NUEVO; $21.218 ; $20.218 ","Unisex","1002121820990"
"Lattafa;LATTAFA BAROQUE ROUGE 540 UNISEX 100 ML EDP ;; $14.076 ; $13.076 ","Unisex","5401001407613990"
"LATTAFA;LATTAFA BAYAAN UNISEX 100ML EDP ;; $19.126 ; $18.126 ","Unisex","1001912618990"
"Lattafa;LATTAFA BLUE OUD HOMBRE 100 ML EDP ;; $17.445 ; $16.445 ","Hombre","1001744516990"
"LATTAFA;LATTAFA ECLAIRE MUJER 100ML EDP ;NUEVO; $25.840 ; $24.840 ","Mujer","1002584024990"
"LATTAFA;LATTAFA EJAAZI MAN 100ML EDP ;; $14.076 ; $13.076 ","Unisex","1001407613990"
"Lattafa;LATTAFA EKHTIARI EDP 100 ML ;; $13.244 ; $12.244 ","Unisex","1001324412990"
"LATTAFA;LATTAFA FAKHAR MAN 100ML EDP ;NUEVO; $19.538 ; $18.538 ","Unisex","1001953818990"
"LATTAFA;LATTAFA FAKHAR WOMAN 100ML + DES 200ML + LOCION EDP ;; $30.050 ; $29.050 ","Unisex","1002003005029990"
"LATTAFA;LATTAFA FAKHAR WOMAN 100ML EDP ;NUEVO; $19.118 ; $18.118 ","Unisex","1001911818990"
"LATTAFA;LATTAFA HAPPY RIDERS EDP 75 ML ;; $11.143 ; $10.143 ","Unisex","751114310990"
"LATTAFA;LATTAFA HAYAATI AL MALEKY HOMBRE 100 ML EDP ;; $14.664 ; $13.664 ","Hombre","1001466413990"
"LATTAFA;LATTAFA HAYAATI GOLD ELIXIR 100ML EDP ;NUEVO; $14.504 ; $13.504 ","Unisex","1001450413990"
"Lattafa;LATTAFA HAYAATI HOMBRE 100 ML EDP ;; $14.496 ; $13.496 ","Hombre","1001449613990"
"LATTAFA;LATTAFA HER CONFESSION EDP 100 ML ;NUEVO; $26.681 ; $25.681 ","Unisex","1002668125990"
"LATTAFA;LATTAFA HIS CONFESSION 100ML EDP ;NUEVO; $26.681 ; $25.681 ","Unisex","1002668125990"
"LATTAFA;LATTAFA HONOR & GLORY UNISEX 100 ML EDP ;NUEVO; $21.647 ; $20.647 ","Unisex","1002164720990"
"LATTAFA;LATTAFA KHAMRAH 100ML EDP ;; $23.235 ; $22.235 ","Unisex","1002323522990"
"Lattafa;LATTAFA KISMET FOR WOMAN 100 ML EDP ;NUEVO; $19.966 ; $18.966 ","Unisex","1001996618990"
"LATTAFA;LATTAFA MAAHIR GOLD EDITION MAN 100ML EDP ;; $23.328 ; $22.328 ","Unisex","1002332822990"
"Lattafa;LATTAFA MAAHIR LEGACY HOMBRE 100 ML EDP ;NUEVO; $21.218 ; $20.218 ","Hombre","1002121820990"
"LATTAFA;LATTAFA MAYAR CHERRY INTENSE EDP 100ML ;NUEVO; $21.639 ; $20.639 ","Unisex","1002163920990"
"LATTAFA;LATTAFA MAYAR MUJER 100 ML EDP ;NUEVO; $22.059 ; $21.059 ","Mujer","1002205921990"
"LATTAFA;LATTAFA MAYAR NATURAL INTENSE 100ML EDP ;NUEVO; $19.118 ; $18.118 ","Unisex","1001911818990"
"Lattafa;LATTAFA NEBRAS UNISEX 100ML EDP ;NUEVO; $24.160 ; $23.160 ","Unisex","1002416023990"
"Lattafa;LATTAFA OPULENT OUD HOMBRE 100 ML EDP ;; $17.445 ; $16.445 ","Hombre","1001744516990"
"LATTAFA;LATTAFA OUD FOR GLORY 100ML EDP ;NUEVO; $21.639 ; $20.639 ","Unisex","1002163920990"
"Lattafa;LATTAFA OUD MOOD ELIXIR UNISEX 100 ML EDP ;; $19.126 ; $18.126 ","Unisex","1001912618990"
"Lattafa;LATTAFA OUD MOOD UNISEX 100ML EDP ;; $19.126 ; $18.126 ","Unisex","1001912618990"
"LATTAFA;LATTAFA PRIDE FAKHAR GOLD UNISEX 100 ML EDP ;; $18.697 ; $17.697 ","Unisex","1001869717990"
"LATTAFA;LATTAFA PRIDE ISHQ AL SHUKUYUKH 100ML EDP ;NUEVO; $21.639 ; $20.639 ","Unisex","1002163920990"
"Lattafa;LATTAFA PRIDE MAHARJAN GOLD UNISEX 100 ML EDP ;; $25.849 ; $24.849 ","Unisex","1002584924990"
"LATTAFA;LATTAFA QAED AL FURSAN MAN 100ML EDP ;NUEVO; $14.832 ; $13.832 ","Unisex","1001483213990"
"LATTAFA;LATTAFA QAED AL FURSAN UNTAMED EDP 90 ML ;NUEVO; $14.916 ; $13.916 ","Unisex","901491613990"
"Lattafa;LATTAFA QASAED AL SULTAN 100 ML EDP ;NUEVO; $16.605 ; $15.605 ","Unisex","1001660515990"
"Lattafa;LATTAFA QIMMAH MUJER 100 ML EDP ;NUEVO; $18.445 ; $17.445 ","Mujer","1001844517990"
"LATTAFA;LATTAFA RAED SILVER MAN 100ML EDP ;; $17.445 ; $16.445 ","Unisex","1001744516990"
"Lattafa;LATTAFA RAMZ HOMBRE 100 ML EDP ;NUEVO; $13.992 ; $12.992 ","Hombre","1001399213990"
"LATTAFA;LATTAFA RAMZ SILVER HOMBRE 100 ML EDP ;; $14.076 ; $13.076 ","Hombre","1001407613990"
"LATTAFA;LATTAFA RAVE NOW BLACK 100 ML EDP ;NUEVO; $15.336 ; $14.336 ","Unisex","1001533614990"
"Lattafa;LATTAFA RAVE NOW PINK WOMEN 100ML EDP ;NUEVO; $17.437 ; $16.437 ","Hombre","1001743716990"
"LATTAFA;LATTAFA SEHR MAN 100ML EDP ;; $30.471 ; $29.471 ","Unisex","1003047129990"
"Lattafa;LATTAFA SER AL KHULOOD UNISEX 100 ML EDP ;; $16.605 ; $15.605 ","Unisex","1001660515990"
"Lattafa;LATTAFA SER AL MALIKA ATTAR AL GHALIA MUJER 100 ML EDP ;; $19.126 ; $18.126 ","Mujer","1001912618990"
"LATTAFA;LATTAFA SHAHEEN GOLD MAN 100ML EDP ;; $20.723 ; $19.723 ","Unisex","1002072319990"
"Lattafa;LATTAFA SHAHEEN SILVER HOMBRE 100 ML EDP ;; $24.168 ; $23.168 ","Hombre","1002416823990"
"Lattafa;LATTAFA SHEIKK SHUYUKK LUXE EDITION 100 ML EDP ;NUEVO; $19.966 ; $18.966 ","Unisex","1001996618990"
"LATTAFA;LATTAFA SUTOOR EDP 100 ML ;; $18.202 ; $17.202 ","Unisex","1001820217990"
"Lattafa;LATTAFA TERIAQ EDP 100 ML UNISEX ;; $24.580 ; $23.580 ","Unisex","1002458023990"
"Lattafa;LATTAFA THE KINGDOM MAN 100ML EDP ;NUEVO; $24.160 ; $23.160 ","Unisex","1002416023990"
"Lattafa;LATTAFA ULGAN SAFWAAN OUD HOMBRE 100 ML EDP ;; $19.966 ; $18.966 ","Hombre","1001996618990"
"Lattafa;LATTAFA VELVET OUD UNISEX 100 ML EDP ;; $18.286 ; $17.286 ","Unisex","1001828617990"
"LATTAFA;LATTAFA VICTORIA EDP 100 ML ;NUEVO; $21.639 ; $20.639 ","Unisex","1002163920990"
"LATTAFA;LATTAFA YARA CANDY MUJER 100 ML EDP ;NUEVO; $19.958 ; $18.958 ","Mujer","1001995818990"
"LATTAFA;LATTAFA YARA EDP 12 ML MUJER ;; $7.361 ; $6.361 ","Mujer","1273616990"
"LATTAFA;LATTAFA YARA MOI UNISEX 100ML EDP ;NUEVO; $19.538 ; $18.538 ","Unisex","1001953818990"
"LATTAFA;LATTAFA YARA ROLL ON 10 ML EDP ;; $5.672 ; $4.672 ","Unisex","1056724990"
"Lattafa;LATTAFA YARA TOUS MUJER 100 ML EDP ;; $19.118 ; $18.118 ","Mujer","1001911818990"
"LATTAFA;LATTAFA YARA WOMAN 100ML EDP ;NUEVO; $19.538 ; $18.538 ","Unisex","1001953818990"
"LATTAFA;SPRAY LATTAFA QIMMAH WOMEN PERFUME AMBIENTAL 300 ML MUJER ;; $6.092 ; $5.092 ","Hombre","30060925990"
"LATTAFA;TERIAQ INTENSE EDP 100 ML ;NUEVO; $24.916 ; $23.916 ","Unisex","1002491623990"
"Lattafa - Maison Alhambra;MISON ALHAMBRA MINERVA MUJER EDP 80 ML ;; $13.664 ; $12.664 ","Mujer","801366412990"
"MAISON ALHAMBRA;DESODORANTE LATTAFA BADEE AL OUD SUBLIME SPRAY 200 ML ;; $5.924 ; $4.924 ","Unisex","20059244990"
"MAISON ALHAMBRA;MAISON ALHAMBA MONTAIGNE VANILLE UNISEX 100ML EDP ;; $14.504 ; $13.504 ","Unisex","1001450413990"
"MAISON ALHAMBRA;MAISON ALHAMBRA  JEAN LOWE MATIERE MAN 100ML EDP ;; $16.605 ; $15.605 ","Unisex","1001660515990"
"MAISON ALHAMBRA;MAISON ALHAMBRA AMBER & LEATHER 100ML EDP ;; $14.916 ; $13.916 ","Unisex","1001491613990"
"MAISON ALHAMBRA;MAISON ALHAMBRA BAROQUE BOUGE UNISEX 100ML EDP ;; $13.244 ; $12.244 ","Unisex","1001324412990"
"MAISON ALHAMBRA;MAISON ALHAMBRA CAMILLE 100ML EDP ;; $13.244 ; $12.244 ","Unisex","1001324412990"
"MAISON ALHAMBRA;MAISON ALHAMBRA DARING BLUE 100ML EDP ;NUEVO; $13.992 ; $12.992 ","Unisex","1001399213990"
"MAISON ALHAMBRA;MAISON ALHAMBRA DARK DOOR SPORT HOMBRE 100 ML EDP ;; $14.412 ; $13.412 ","Hombre","1001441213990"
"MAISON ALHAMBRA;MAISON ALHAMBRA EMBRACE 100ML EDP ;; $20.807 ; $19.807 ","Unisex","1002080719990"
"MAISON ALHAMBRA;MAISON ALHAMBRA ENCODE MOUNTAIN 100 ML EDP ;; $14.504 ; $13.504 ","Unisex","1001450413990"
"Maison Alhambra;MAISON ALHAMBRA EXCLUSIF SAFFRON UNISEX 100ML EDP ;; $17.866 ; $16.866 ","Unisex","1001786616990"
"Maison Alhambra;MAISON ALHAMBRA FLORAL AMBROSIA MUJER 100ML EDP ;; $16.605 ; $15.605 ","Mujer","1001660515990"
"Maison Alhambra;MAISON ALHAMBRA GALATEA 100 ML EDP ;; $16.605 ; $15.605 ","Unisex","1001660515990"
"MAISON ALHAMBRA;MAISON ALHAMBRA GLACIER BELLA 100ML EDP ;; $14.496 ; $13.496 ","Unisex","1001449613990"
"MAISON ALHAMBRA;MAISON ALHAMBRA GLACIER LE NOIR HOMBRE 100ML EDP ;; $14.076 ; $13.076 ","Hombre","1001407613990"
"MAISON ALHAMBRA;MAISON ALHAMBRA GLACIER POUR HOMME 100ML EDP ;; $14.412 ; $13.412 ","Hombre","1001441213990"
"MAISON ALHAMBRA;MAISON ALHAMBRA GLACIER ULTRA 30 ML HOMBRE ;; $8.445 ; $7.445 ","Hombre","3084457990"
"Maison Alhambra;MAISON ALHAMBRA GLOSSY 100ML EDP MUJER ;; $20.798 ; $19.798 ","Mujer","1002079819990"
"Maison Alhambra;MAISON ALHAMBRA GUSTA PARFUM 100ML EDP ;NUEVO; $20.798 ; $19.798 ","Unisex","1002079819990"
"MAISON ALHAMBRA;MAISON ALHAMBRA JEAN LOW NOIR 100ML HOMBRE ;; $17.866 ; $16.866 ","Hombre","1001786616990"
"MAISON ALHAMBRA;MAISON ALHAMBRA JEAN LOWE FRAICHE HOMBRE 100ML EDP ;; $19.126 ; $18.126 ","Hombre","1001912618990"
"Maison Alhambra;MAISON ALHAMBRA JEAN LOWE INMORTAL EDP 30 ML ;; $8.445 ; $7.445 ","Unisex","3084457990"
"Maison Alhambra;MAISON ALHAMBRA JUBILANT ROSE 100 ML EDP MUJER ;NUEVO; $13.403 ; $12.403 ","Mujer","1001340312990"
"MAISON ALHAMBRA;MAISON ALHAMBRA KINGSMAN 100 ML EDP ;NUEVO; $13.655 ; $12.655 ","Unisex","1001365512990"
"MAISON ALHAMBRA;MAISON ALHAMBRA KISMET MAGIC 100ML EDP ;NUEVO; $16.605 ; $15.605 ","Unisex","1001660515990"
"MAISON ALHAMBRA;MAISON ALHAMBRA KISMET MAN 100ML EDP ;NUEVO; $19.126 ; $18.126 ","Unisex","1001912618990"
"MAISON ALHAMBRA;MAISON ALHAMBRA LUXE CHIC 100ML EDP ;; $20.807 ; $19.807 ","Unisex","1002080719990"
"MAISON ALHAMBRA;MAISON ALHAMBRA LUXE JOURNEY 100 ML EDP ;; $20.807 ; $19.807 ","Unisex","1002080719990"
"Maison Alhambra;MAISON ALHAMBRA MAITRE PARFUM HOMBRE 100ML EDP ;NUEVO; $14.076 ; $13.076 ","Hombre","1001407613990"
"MAISON ALHAMBRA;MAISON ALHAMBRA MYSTERIOUS AMBER 100ML EDP ;; $16.605 ; $15.605 ","Unisex","1001660515990"
"Maison Alhambra;MAISON ALHAMBRA NARISA AMBRE MUJER 100ML EDP ;; $15.756 ; $14.756 ","Mujer","1001575614990"
"Maison Alhambra;MAISON ALHAMBRA NARISSA FOR HER MUJER 100ML EDP ;; $13.244 ; $12.244 ","Mujer","1001324412990"
"MAISON ALHAMBRA;MAISON ALHAMBRA NO 2 MEN 80ML EDP ;; $14.328 ; $13.328 ","Hombre","2801432813990"
"MAISON ALHAMBRA;MAISON ALHAMBRA OPERAM NOIR ROUGE 100ML EDP ;NUEVO; $14.076 ; $13.076 ","Unisex","1001407613990"
"MAISON ALHAMBRA;MAISON ALHAMBRA PHILOS PURA OPUS NOIR EDP MUJER ;; $14.084 ; $13.084 ","Mujer","1408413990"
"Maison Alhambra;MAISON ALHAMBRA PINK VELVET MUJER 30ML EDP ;; $8.622 ; $7.622 ","Mujer","3086227990"
"MAISON ALHAMBRA;MAISON ALHAMBRA PORTO NEROLI WOMAN 100 ML EDP ;; $14.084 ; $13.084 ","Unisex","1001408413990"
"MAISON ALHAMBRA;MAISON ALHAMBRA QUEENSTOWN POUR FEMME 100 ML EDP ;; $13.244 ; $12.244 ","Mujer","1001324412990"
"MAISON ALHAMBRA;MAISON ALHAMBRA ROSE PETALS WOMAN 100ML EDP ;; $12.403 ; $11.403 ","Unisex","1001240311990"
"MAISON ALHAMBRA;MAISON ALHAMBRA SALVO ELIXIR  EDP 30 ML ;; $8.622 ; $7.622 ","Unisex","3086227990"
"MAISON ALHAMBRA;MAISON ALHAMBRA SENSUAL VANILLA UNISEX 100ML EDP ;; $16.605 ; $15.605 ","Unisex","1001660515990"
"Maison Alhambra;MAISON ALHAMBRA SO CANDID POUR HOMME EDP 100 ML HOMBRE ;; $15.336 ; $14.336 ","Hombre","1001533614990"
"Maison Alhambra;MAISON ALHAMBRA SO CANDID ROUGE 80ML EDP ;; $15.588 ; $14.588 ","Unisex","801558814990"
"MAISON ALHAMBRA;MAISON ALHAMBRA SPECTRUM 100 ML EDP ;; $17.025 ; $16.025 ","Unisex","1001702516990"
"MAISON ALHAMBRA;MAISON ALHAMBRA TORO POUR HOMME GLACE MAN 100 ML EDP ;; $14.840 ; $13.840 ","Hombre","1001484013990"
"MAISON ALHAMBRA;MAISON ALHAMBRA VICTORIA FLOWER EDP 100 ML ;; $13.244 ; $12.244 ","Unisex","1001324412990"
"MAISON ALHAMBRA;MAISON ALHAMBRA VICTORIOSO LEGACY EDP 100 ML UNISEX ;; $14.798 ; $13.798 ","Unisex","1001479813990"
"Maison Alhambra;MAISON ALHAMBRA XCLUSIF ROSE 100 ML EDP ;; $17.866 ; $16.866 ","Unisex","1001786616990"
"MAISON ALHAMBRA;MAISON ALHAMBRA YOUR TOUCH AMBER EDP 100 ML HOMBRE ;; $14.336 ; $13.336 ","Hombre","1001433613990"
"MAISON ALHAMBRA;MAISON ALHAMBRA YOUR TOUCH HOMBRE 30ML EDP ;; $8.613 ; $7.613 ","Hombre","3086137990"
"MAISON ALHAMBRA;MAISON ALHAMBRA YOUR TOUCH MUJER 100 ML EDP ;NUEVO; $14.076 ; $13.076 ","Mujer","1001407613990"
"MARC JACOBS;MARC JACBS PERFECT EDT 50ML MUJER ;; $63.992 ; $62.992 ","Mujer","506399263990"
"MARC JACOBS;MARC JACOBS DAISY MUJER 100 ML EDT ;; $73.992 ; $72.992 ","Mujer","1007399273990"
"MARC JACOBS;MARC JACOBS DAISY WOMAN 50 ML EDT ;; $62.815 ; $61.815 ","Unisex","506281561990"
"MARC JACOBS;MARC JACOBS PERFECT ELIXIR 50ML MUJER EDP ;; $62.815 ; $61.815 ","Mujer","506281561990"
"MARC JACOBS;MARC JACOBS PERFECT INTENSE MUJER 50ML EDP ;; $62.815 ; $61.815 ","Mujer","506281561990"
"MONT BLANC;MONT BLANC EXPLORER 100ML EDP ;; $37.605 ; $36.605 ","Unisex","1003760536990"
"MONT BLANC;MONT BLANC LEGEND MAN 100ML EDP ;NUEVO; $37.605 ; $36.605 ","Unisex","1003760536990"
"MONT BLANC;MONT BLANC LEGEND MAN 100ML EDT ;NUEVO; $34.672 ; $33.672 ","Unisex","1003467233990"
"MONT BLANC;MONT BLANC LEGEND SPIRIT MAN 100ML EDT ;; $38.697 ; $37.697 ","Unisex","1003869737990"
"Montblanc;MONT BLANC LEGENT SPIRIT 200 ML MAN ;; $43.151 ; $42.151 ","Unisex","2004315142990"
"MOSCHINO;MOSCHINO TOY 2 BUBBLE GUM 100ML EDT ;; $40.126 ; $39.126 ","Unisex","21004012639990"
"MOSCHINO;MOSCHINO TOY 2 PEARL 100ML EDP MUJER ;; $49.874 ; $48.874 ","Mujer","21004987448990"
"MOSCHINO;MOSCHINO TOY 2 WOMAN 100ML EDT ;; $39.286 ; $38.286 ","Unisex","21003928638990"
"MOSCHINO;MOSCHINO TOY BOY 100ML EDP ;; $42.815 ; $41.815 ","Unisex","1004281541990"
"Moschino;TESTER MOSCHINO TOY 2 BUBBLE GUM WOMAN 100ML EDT ;; $35.084 ; $34.084 ","Unisex","21003508434990"
"MOSCHINO;TESTER MOSCHINO TOY 2 PEARL MUJER 100ML EDP ;; $41.815 ; $40.815 ","Mujer","21004181540990"
"MOSCHINO;TESTER MOSCHINO TOY BOY EDP 100ML ;; $36.429 ; $35.429 ","Unisex","1003642935990"
"MUGLER;MUGLER ALIEN HYPERSENSE 60 ML EDP ;; $51.891 ; $50.891 ","Unisex","605189150990"
"MUGLER;MUGLER ANGEL MUJER 50 ML EDP ;; $83.992 ; $82.992 ","Mujer","508399283990"
"Mush Mush;MUSH MUSH DIVINE NECTAR MUJER 100 ML EDP ;; $25.000 ; $24.000 ","Mujer","1002500024990"
"Mush Mush;MUSH MUSH MORNING BREEZE MUJER 100ML EDP ;; $11.983 ; $10.983 ","Mujer","1001198310990"
"Orientica;ORIENTICA LE MOTIF IMPERIAL GOLD UNISEX 85ML EDP ;; $37.109 ; $36.109 ","Unisex","853710936990"
"Orientica;ORIENTICA LE MOTIF WILD NEROLI MAN 85ML EDP ;; $36.773 ; $35.773 ","Unisex","853677335990"
"Orientica;ORIENTICA XCLUSIF CLASSIC UNISEX 60 ML EDP ;; $45.176 ; $44.176 ","Unisex","604517644990"
"Orientica;ORIENTICA XCLUSIF EMERALD UNISEX 60 ML EDP ;; $45.176 ; $44.176 ","Unisex","604517644990"
"Paco Rabanne;PACO RABANNE 1 MILLION ROYAL MAN PARFUM 100ML EDP ;NUEVO; $69.546 ; $68.546 ","Unisex","11006954668990"
"Paco Rabanne;PACO RABANNE BLACK XS MAN 100ML EDT ;; $48.047 ; $47.047 ","Unisex","1004804747990"
"PACO RABANNE;PACO RABANNE INVICTUS MAN 100ML EDT ;; $71.218 ; $70.218 ","Unisex","1007121870990"
"Paco Rabanne;PACO RABANNE INVICTUS MAN 50 ML EDT ;NUEVO; $50.218 ; $49.218 ","Unisex","505021849990"
"Paco Rabanne;PACO RABANNE OLYMPEA WOMAN 80ML EDP ;; $69.958 ; $68.958 ","Unisex","806995868990"
"PACO RABANNE;PACO RABANNE ONE MILLION ELIXIR PARFUM INTENSE 100ML ;; $83.824 ; $82.824 ","Unisex","1008382482990"
"PACO RABANNE;PACO RABANNE ONE MILLION MAN 100ML EDT ;; $71.050 ; $70.050 ","Unisex","1007105070990"
"PACO RABANNE;PACO RABANNE PHANTOM 100ML EDT ;; $76.933 ; $75.933 ","Unisex","1007693375990"
"PACO RABANNE;PACO RABANNE PHANTOM INTENSE EDP INTENSE 100 ML  HOMBRE ;; $85.504 ; $84.504 ","Hombre","1008550484990"
"Paco Rabanne;PACO RABANNE ULTRA RED HOMBRE 100 ML EDT ;NUEVO; $29.210 ; $28.210 ","Hombre","1002921028990"
"Paco Rabanne;PACO RABANNE ULTRAVIOLET MAN 100ML EDT ;NUEVO; $38.445 ; $37.445 ","Unisex","1003844537990"
"Paco Rabanne;TESTER PACO RABANNE INVICTUS MAN EDT 100 ML HOMBRE ;NUEVO; $54.000 ; $53.000 ","Hombre","1005400053990"
"Paco Rabanne;TESTER PACO RABANNE LADY MILLION 80ML EDP ;NUEVO; $54.000 ; $53.000 ","Unisex","805400053990"
"Paco Rabanne;TESTER PACO RABANNE PHANTOM MAN 100ML EDT ;NUEVO; $54.000 ; $53.000 ","Unisex","1005400053990"
"PARIS CORNER;PARIS CORNER KHAIR CONFECTION 100ML EDP ;; $15.756 ; $14.756 ","Unisex","1001575614990"
"PARIS CORNER;PARIS CORNER KHAIR FUSION EDP 100 ML UNISEX ;NUEVO; $15.756 ; $14.756 ","Unisex","1001575614990"
"Paris Corner;PARIS CORNER KHAIR PISTACHIO 100ML EDP ;; $16.933 ; $15.933 ","Unisex","1001693315990"
"PARIS CORNER;PARIS CORNER MARSHMALLOW BLUSH EDP 100 ML MUJER ;NUEVO; $26.933 ; $25.933 ","Mujer","1002693325990"
"Perfumes;PARIS HILTON CAN CAN 100ML EDP ;; $24.168 ; $23.168 ","Unisex","1002416823990"
"POR DEFINIR;AJMAL SHINE FOR HER 75ML EDP ;; $19.126 ; $18.126 ","Unisex","751912618990"
"POR DEFINIR;ANTONIO BANDERAS BLUE SEDUCTION EDT 50 ML HOMBRE ;; $13.655 ; $12.655 ","Hombre","501365512990"
"POR DEFINIR;ANTONIO BANDERAS THE ICON EDP 1.5 ML MUJER (12 PIEZAS) ;; $5.840 ; $4.840 ","Mujer","151258404990"
"POR DEFINIR;ARMAF ODYSSEY BAHAMAS EDP 100 ML UNISEX ;; $29.202 ; $28.202 ","Unisex","1002920228990"
"POR DEFINIR;ARMAF ODYSSEY BLACK FOREST DESSERT EDITION EDP 100 ML UNISEX ;; $26.681 ; $25.681 ","Unisex","1002668125990"
"POR DEFINIR;Armaf Odyssey Limoni Fresh Edition EDP 60 ML Unisex ;; $14.916 ; $13.916 ","Unisex","601491613990"
"POR DEFINIR;ARMAF ODYSSEY REVOLUTION ULTRA EDITION EDP 100 ML UNISEX ;; $25.840 ; $24.840 ","Unisex","1002584024990"
"POR DEFINIR;ARMAF ODYSSEY TOFFEE COFFEE EDP 100 ML UNISEX ;; $22.479 ; $21.479 ","Unisex","1002247921990"
"POR DEFINIR;ARMAF VENTANA MARINE EDP 100 ML  UNISEX ;; $21.639 ; $20.639 ","Unisex","1002163920990"
"POR DEFINIR;ASDAAF REEM EDP 100 ML UNISEX ;NUEVO; $19.538 ; $18.538 ","Unisex","1001953818990"
"POR DEFINIR;ASTEN GENIUS MAN EDP 100 ML ;; $13.655 ; $12.655 ","Unisex","1001365512990"
"POR DEFINIR;ASTEN MY LIFE EDP 100 ML MUJER ;; $13.655 ; $12.655 ","Mujer","1001365512990"
"POR DEFINIR;AZZARO THE MOST WANTED EDP INTENSE 150 ML HOMBRE ;NUEVO; $70.714 ; $69.714 ","Hombre","1507071469990"
"POR DEFINIR;AZZARO WANTED EDT 100 ML HOMBRE ;; $37.353 ; $36.353 ","Hombre","1003735336990"
"POR DEFINIR;AZZARO WANTED FOREVER ELIXIR PARFUM 100 ML HOMBRE ;; $94.916 ; $93.916 ","Hombre","1009491693990"
"POR DEFINIR;BODY MIST VICTORIA SECRET AMBER ROMANCE 250 ML ;; $14.832 ; $13.832 ","Unisex","2501483213990"
"POR DEFINIR;BODY MIST VICTORIA SECRET TEMPTATION 250 ML ;; $13.403 ; $12.403 ","Unisex","2501340312990"
"POR DEFINIR;BOSS BOTTLED BEYOND EDP 100 ML RECARGABLE HOMBRE ;; $68.445 ; $67.445 ","Hombre","1006844567990"
"POR DEFINIR;BURBERRY HER EDP INTENSE 100 ML MUJER ;; $86.345 ; $85.345 ","Mujer","1008634585990"
"POR DEFINIR;CALVIN KLEIN CK ONE EDT 200 ML + 200 ML SET 2 PCS SHOWER GEL ;; $27.521 ; $26.521 ","Unisex","20020022752126990"
"POR DEFINIR;CALVIN KLEIN DEFY HOMBRE 50 ML EDT ;; $17.445 ; $16.445 ","Hombre","501744516990"
"POR DEFINIR;CAROLINA HERRERA 212 VIP MEN EDT 100 ML HOMBRE ;; $60.294 ; $59.294 ","Hombre","2121006029459990"
"POR DEFINIR;CAROLINA HERRERA GOOD GIRL EDP 100 ML REFILLABLE MUJER ;; $172.067 ; $171.067 ","Mujer","100172067171990"
"POR DEFINIR;CAROLINA HERRERA GOOD GIRL EDP L�GERE 50 ML MUJER ;; $57.773 ; $56.773 ","Mujer","505777356990"
"POR DEFINIR;DESODORANTE LATTAFA ANDALEEB SPRAY 200 ML MUJER ;; $6.092 ; $5.092 ","Mujer","20060925990"
